Category,Message,Senders_Anonimity,legitimate_contact_info,Appealing_Subject
ham,"Hey, a guy I know is breathing down my neck to get him some bud, anyway you'd be able to get a half track to usf tonight?",no,yes,no
spam,PRIVATE! Your 2003 Account Statement for shows 800 un-redeemed S. I. M. points. Call 08715203652 Identifier Code: 42810 Expires 29/10/0,yes,no,yes
ham,That's one of the issues but california is okay. No snow so its manageable,no,yes,no
ham,All boys made fun of me today. Ok i have no problem. I just sent one message just for fun,no,yes,no
ham,....photoshop makes my computer shut down.,no,yes,no
spam,u r a winner U ave been specially selected 2 receive å£1000 cash or a 4* holiday (flights inc) speak to a live operator 2 claim 0871277810710p/min (18 ),yes,no,yes
ham,Im good! I have been thinking about you...,no,yes,no
ham,Got smaller capacity one? Quite ex...,no,yes,no
ham,Ummmmmaah Many many happy returns of d day my dear sweet heart.. HAPPY BIRTHDAY dear,no,yes,no
spam,URGENT This is our 2nd attempt to contact U. Your å£900 prize from YESTERDAY is still awaiting collection. To claim CALL NOW 09061702893,yes,no,yes
ham,Saw Guys and Dolls last night with Patrick Swayze it was great,no,yes,no
